{
  "schema_version": "1.0",
  "family": "uapi",
  "group": "AddonDomain",
  "operations": {
    "uapi:AddonDomain/addaddondomain": {
      "name": "addAddonDomain",
      "method": "POST",
      "order": [
        "newdomain",
        "subdomain",
        "dir",
        "disallowdot",
        "force"
      ],
      "params": {
        "newdomain": {
          "php": "newDomain"
        },
        "disallowdot": {
          "php": "disallowDot"
        }
      },
      "notes": [
        {
          "kind": "documented",
          "text": "Available in cPanel 138. This function creates an addon domain on the cPanel account. It creates a\nsubdomain of the account's primary domain and then parks the new domain on\nthat subdomain.\n\n**Important:**\n\n- The account's primary domain may **not** be a subdomain of the addon\n  domain that you create.\n- You cannot create a wildcard addon domain.\n- If the subdomain already exists on the account, the system reuses it\n  rather than failing.\n- If the park step fails, the system removes the subdomain it created, so\n  that a failed call does not leave a partial addon domain behind.\n- The system also creates an [FTP](https://go.cpanel.net/ftpaccounts)\n  account for the addon domain, which counts against the account's FTP\n  account limit.\n\nWhen you disable the [Web Server role](https://go.cpanel.net/serverroles#roles),\nthe system **disables** this function."
        },
        {
          "kind": "documented",
          "text": "subdomain: The label of the subdomain to create on the account's primary domain and park the addon domain on. This value may **not** contain an asterisk (`*`)."
        },
        {
          "kind": "documented",
          "text": "dir: The addon domain's document root, given as a directory path relative to the account's home directory.\n\nThis value defaults to the subdomain label beneath the account's `public_html` directory."
        },
        {
          "kind": "documented",
          "text": "disallowdot: Whether to remove the dot (`.`) characters from the `subdomain` value.\n* `1` - Remove dots from the subdomain label.\n* `0` - Do **not** remove dots from the subdomain label."
        },
        {
          "kind": "documented",
          "text": "force: Accepted for compatibility, but ignored for account-level callers. It can no longer cause the system to skip the domain name, [DNS](https://go.cpanel.net/dnsrecords), and registration checks, or to overwrite an existing DNS zone.\n\nThe system still refuses to create a domain that another account owns.\n* `0` - Enforce the checks.\n* `1` - Accepted, but has no effect for account-level callers."
        }
      ],
      "evidence": [
        {
          "kind": "doc",
          "version": "pinned 2026-10-13",
          "date": "2026-10-30",
          "note": "Pinned cpanel.openapi.json SHA-256 172660ce0d8e0868756dabf8e3243ea41399aac7bff06082d806c73f71a094fc, /AddonDomain/addaddondomain GET x-readonly=false. Mutations use form POST; preserve the source parameter names and omission semantics."
        }
      ]
    },
    "uapi:AddonDomain/deladdondomain": {
      "name": "deleteAddonDomain",
      "method": "POST",
      "order": [
        "domain",
        "subdomain",
        "disallowdot"
      ],
      "params": {
        "disallowdot": {
          "php": "disallowDot"
        }
      },
      "notes": [
        {
          "kind": "documented",
          "text": "Available in cPanel 138. This function removes an addon domain from the cPanel account. It unparks\nthe addon domain and then removes the subdomain that the domain was parked\non.\n\n**Important:**\n\n- The `domain` and `subdomain` values must match each other. If the\n  subdomain does not correspond to the addon domain, the function fails.\n- If other domains are still parked on the subdomain, the system unparks\n  the addon domain but leaves the subdomain in place, and says so in the\n  `messages` field.\n- This function does **not** remove the addon domain's document root or\n  the files in it.\n\nWhen you disable the [Web Server role](https://go.cpanel.net/serverroles#roles),\nthe system **disables** this function."
        },
        {
          "kind": "documented",
          "text": "domain: The addon domain to remove."
        },
        {
          "kind": "documented",
          "text": "subdomain: The subdomain that the addon domain is parked on, given in the underscore-separated `subdomain_rootdomain` form that the `AddonDomain::listaddondomains` function returns in its `domainkey` field."
        },
        {
          "kind": "documented",
          "text": "disallowdot: Whether to remove the dot (`.`) characters from the subdomain label when the system removes the subdomain.\n* `1` - Remove dots from the subdomain label.\n* `0` - Do **not** remove dots from the subdomain label."
        }
      ],
      "void": true,
      "evidence": [
        {
          "kind": "doc",
          "version": "pinned 2026-10-13",
          "date": "2026-10-30",
          "note": "Pinned cpanel.openapi.json SHA-256 172660ce0d8e0868756dabf8e3243ea41399aac7bff06082d806c73f71a094fc, /AddonDomain/deladdondomain GET x-readonly=false. Mutations use form POST; preserve the source parameter names and omission semantics."
        },
        {
          "kind": "doc",
          "version": "pinned 2026-10-13",
          "date": "2026-10-30",
          "note": "Pinned cpanel.openapi.json SHA-256 172660ce0d8e0868756dabf8e3243ea41399aac7bff06082d806c73f71a094fc, /AddonDomain/deladdondomain GET responses/200/content/application~1json/schema/properties/data explicitly states: This function does not return data. Check the status field for the outcome, and the messages and errors fields for detail. The data node declares no type or fields; expose null under the documented void contract."
        }
      ]
    },
    "uapi:AddonDomain/listaddondomains": {
      "name": "listAddonDomains",
      "order": [
        "regex",
        "return_https_redirect_status"
      ],
      "notes": [
        {
          "kind": "documented",
          "text": "Available in cPanel 138. This function lists the cPanel account's addon domains: the domains that\nare parked on a subdomain of the account's primary domain, rather than on\nthe primary domain itself.\n\n**Note:**\n\nUse the `Park::listparkeddomains` function for the domains parked on the\nprimary domain."
        }
      ]
    }
  }
}
