{
  "schema_version": "1.0",
  "family": "uapi",
  "group": "DNS",
  "operations": {
    "uapi:DNS/ensure_domains_reside_only_locally": {"params": {"domain": {"php": "domains", "encoding": "repeat"}}, "evidence": [{"kind": "doc", "version": "pinned 2026-10-13", "date": "2026-10-15", "note": "The pinned domain description documents checking several domains by repeating the domain parameter (or by incrementing it as domain-1, domain-2); the list is sent as repeated domain keys."}], "response": {"[]": {"nullable": true, "evidence": [{"kind": "doc", "version": "pinned 2026-10-13", "date": "2026-10-15", "note": "The data description documents a null result for a domain that only resolves locally, but the item schema declares a non-nullable string."}, {"kind": "live", "version": "11.138.0.15", "date": "2026-10-15", "note": "ensure_domains_reside_only_locally returned a one-item list whose item was an explicit null on both the direct and bridged routes; docs/api/source-audit.md#runtime-observations-2026-10-15-dns-slice"}]}}},
    "uapi:DNS/ensure_domains_use_recognized_nameservers": {"params": {"domain": {"php": "domains", "encoding": "repeat"}}, "evidence": [{"kind": "doc", "version": "pinned 2026-10-13", "date": "2026-10-15", "note": "The pinned domain description documents checking several domains by repeating the domain parameter (or by incrementing it as domain-1, domain-2); the list is sent as repeated domain keys."}]},
    "uapi:DNS/fetch_cpanel_generated_domains": {},
    "uapi:DNS/has_local_authority": {"params": {"domain": {"php": "domains", "encoding": "repeat"}}, "evidence": [{"kind": "doc", "version": "pinned 2026-10-13", "date": "2026-10-15", "note": "The pinned domain description documents checking several domains by incrementing or duplicating the domain parameter name; the list is sent as repeated domain keys."}], "response": {"[].error": {"nullable": true, "evidence": [{"kind": "live", "version": "11.138.0.15", "date": "2026-10-15", "note": "has_local_authority returned [].error as an explicit null on both the direct and bridged routes when the authority check succeeded, although the pinned schema declares a string returned only on failure; docs/api/source-audit.md#runtime-observations-2026-10-15-dns-slice"}]}}},
    "uapi:DNS/is_alias_available": {"response": {"resolver": {"nullable": true, "evidence": [{"kind": "live", "version": "11.138.0.15", "date": "2026-10-15", "note": "is_alias_available returned resolver as an explicit null on both the direct and bridged routes when no PowerDNS resolver setting exists, although the pinned schema declares a string; docs/api/source-audit.md#runtime-observations-2026-10-15-dns-slice"}]}}},
    "uapi:DNS/is_https_available": {},
    "uapi:DNS/is_svcb_available": {},
    "uapi:DNS/lookup": {"name": "lookup"},
    "uapi:DNS/parse_zone": {"response": {"[]": {"replace": {"type": "object", "fields": {"data_b64": {"type": "list", "items": {"type": "string"}}, "dname_b64": {"type": "string"}, "line_index": {"type": "int"}, "record_type": {"type": "string"}, "text_b64": {"type": "string"}, "ttl": {"type": "int"}, "type": {"type": "string"}}}, "evidence": [{"kind": "doc", "version": "pinned 2026-10-13", "date": "2026-10-15", "note": "The documented list item is a oneOf of record, control and comment objects whose fields are all optional; the generated union keeps the first matching branch and would drop text_b64 from control and comment lines, so the branches are merged into one object with every documented field optional."}]}}}
  }
}
